{"schema_version":1,"id":"b7a1e0d4-5c2f-4f6a-8b13-0d9e4c7a2f55","type":"response","correlation_id":"3f0c1c52-8a43-4c1e-9d0e-6a1b2f7d9e10","from":"knowledge","to":"assistant","created_at":"2026-10-23T09:15:01.250Z","operation":"documents_search","context":{"user_id":"u-42","task_id":"t-1001"},"payload":{"documents":[{"id":"d-17","title":"Probes","summary":"Liveness and readiness probes.","tags":["ops"],"score":0.82,"url":"https://wiki.example/probes"}]}}
