{"schema_version":1,"id":"3f0c1c52-8a43-4c1e-9d0e-6a1b2f7d9e10","type":"request","correlation_id":"3f0c1c52-8a43-4c1e-9d0e-6a1b2f7d9e10","from":"assistant","to":"knowledge","created_at":"2026-10-23T09:15:00Z","operation":"documents_search","context":{"user_id":"u-42","task_id":"t-1001"},"summary":"Find documents about kubernetes probes","payload":{"query":"kubernetes liveness probe","tags":["ops"],"limit":5,"offset":0}}
